<?xml version="1.0" encoding="UTF-8"?>
<ns2:Create_DPR xmlns:ns2="http://www.yawlfoundation.org/sb/DPRinfo" xmlns:xsi="http://www.w3.org/2001/XMLSchema-instance" xsi:schemaLocation="http://www.yawlfoundation.org/sb/DPRinfo ../DPRinfoType.xsd ">
  <generalInfo>
    <production>production</production>
    <date>2001-01-01</date>
    <weekday>weekday</weekday>
    <shootDayNo>0</shootDayNo>
  </generalInfo>
  <producer>producer</producer>
  <director>director</director>
  <productionManager>productionManager</productionManager>
  <directorOfPhotography>directorOfPhotography</directorOfPhotography>
  <DPRinfo>
    <startDate>2001-01-01</startDate>
    <scheduledFinish>2001-01-01</scheduledFinish>
    <revisedFinish>2001-01-01</revisedFinish>
    <shootingDaysSchedule>
      <scheduledDays>0</scheduledDays>
      <daysToDate>0</daysToDate>
      <estdToComplete>0</estdToComplete>
      <estdTotal>0</estdTotal>
    </shootingDaysSchedule>
    <locationSets>
      <singleLocation>
        <locationName>locationName</locationName>
        <address>address</address>
        <set>set</set>
      </singleLocation>
    </locationSets>
    <slateNOs>
      <slate>slate</slate>
    </slateNOs>
    <scheduledScenesShot>
      <scene>scene</scene>
    </scheduledScenesShot>
    <scheduledScenesNotShot>
      <scene>scene</scene>
    </scheduledScenesNotShot>
    <ScenesNotYetCompleted>
      <scene>scene</scene>
    </ScenesNotYetCompleted>
    <ScenesDeleted>
      <scene>scene</scene>
    </ScenesDeleted>
    <ScenesAdded>
      <scene>scene</scene>
    </ScenesAdded>
    <unscheduledScenesShot>
      <scene>scene</scene>
    </unscheduledScenesShot>
    <scriptTiming>
      <prevShot>
        <scenes>0</scenes>
        <pageTime>
          <number>0</number>
          <numerator>0</numerator>
        </pageTime>
        <estTiming>12:00:00</estTiming>
        <actualTiming>12:00:00</actualTiming>
      </prevShot>
      <shotToday>
        <scenes>0</scenes>
        <pageTime>
          <number>0</number>
          <numerator>0</numerator>
        </pageTime>
        <estTiming>12:00:00</estTiming>
        <actualTiming>12:00:00</actualTiming>
      </shotToday>
      <shotTodate>
        <scenes>0</scenes>
        <pageTime>
          <number>0</number>
          <numerator>0</numerator>
        </pageTime>
        <estTiming>12:00:00</estTiming>
        <actualTiming>12:00:00</actualTiming>
      </shotTodate>
      <toBeShot>
        <scenes>0</scenes>
        <pageTime>
          <number>0</number>
          <numerator>0</numerator>
        </pageTime>
        <estTiming>12:00:00</estTiming>
        <actualTiming>12:00:00</actualTiming>
      </toBeShot>
      <total>
        <scenes>0</scenes>
        <pageTime>
          <number>0</number>
          <numerator>0</numerator>
        </pageTime>
        <estTiming>12:00:00</estTiming>
        <actualTiming>12:00:00</actualTiming>
      </total>
    </scriptTiming>
    <ratioTimingSpec>
      <scheduledRatio>0.0</scheduledRatio>
      <dailyRatio>0.0</dailyRatio>
      <averageRatio>0.0</averageRatio>
      <averageTiming>12:00:00</averageTiming>
      <cumulative>
        <sign>true</sign>
        <varTime>12:00:00</varTime>
      </cumulative>
      <originalTiming>12:00:00</originalTiming>
    </ratioTimingSpec>
    <stockInfo>
      <previously>
        <loaded>0</loaded>
        <gross>0</gross>
        <exposed>0</exposed>
        <print>0</print>
        <N_G>0</N_G>
        <waste>0</waste>
        <shortEnds>0</shortEnds>
        <soundRolls>soundRolls</soundRolls>
        <camRolls>camRolls</camRolls>
      </previously>
      <today>
        <loaded>0</loaded>
        <gross>0</gross>
        <exposed>0</exposed>
        <print>0</print>
        <N_G>0</N_G>
        <waste>0</waste>
        <shortEnds>0</shortEnds>
        <soundRolls>soundRolls</soundRolls>
        <camRolls>camRolls</camRolls>
      </today>
      <totalToDate>
        <loaded>0</loaded>
        <gross>0</gross>
        <exposed>0</exposed>
        <print>0</print>
        <N_G>0</N_G>
        <waste>0</waste>
        <shortEnds>0</shortEnds>
        <soundRolls>soundRolls</soundRolls>
        <camRolls>camRolls</camRolls>
      </totalToDate>
    </stockInfo>
    <artistTimeSheet>
      <singleArtist>
        <artist>artist</artist>
        <character>character</character>
        <P_U>P_U</P_U>
        <MU_WD_Call_scheduled>12:00:00</MU_WD_Call_scheduled>
        <MU_WD_Call_actualArrival>12:00:00</MU_WD_Call_actualArrival>
        <mealBreak>12:00:00</mealBreak>
        <timeWrap>12:00:00</timeWrap>
        <travel>12:00:00</travel>
        <totalHRs>12:00:00</totalHRs>
      </singleArtist>
    </artistTimeSheet>
    <extrasTimeSheet>
      <singleArtist>
        <artist>artist</artist>
        <character>character</character>
        <P_U>P_U</P_U>
        <MU_WD_Call_scheduled>12:00:00</MU_WD_Call_scheduled>
        <MU_WD_Call_actualArrival>12:00:00</MU_WD_Call_actualArrival>
        <mealBreak>12:00:00</mealBreak>
        <timeWrap>12:00:00</timeWrap>
        <travel>12:00:00</travel>
        <totalHRs>12:00:00</totalHRs>
      </singleArtist>
    </extrasTimeSheet>
    <crewTimeSheet>
      <singleCrew>
        <crewName>crewName</crewName>
        <crewRole>crewRole</crewRole>
        <crewCall>12:00:00</crewCall>
        <travelIn>12:00:00</travelIn>
        <locationCall>12:00:00</locationCall>
        <mealBreak>12:00:00</mealBreak>
        <wrap>12:00:00</wrap>
        <wrapLoc>12:00:00</wrapLoc>
        <departLoc>12:00:00</departLoc>
        <travelOut>12:00:00</travelOut>
        <totalHRs>12:00:00</totalHRs>
      </singleCrew>
    </crewTimeSheet>
    <majorProps_actionVehicles_additionalEquipment>majorProps_actionVehicles_additionalEquipment</majorProps_actionVehicles_additionalEquipment>
    <additionalCrew>additionalCrew</additionalCrew>
    <livestocks_other>livestocks_other</livestocks_other>
    <accidents_delays>accidents_delays</accidents_delays>
    <catering>
      <singleMeal>
        <meal>meal</meal>
        <time>12:00:00</time>
        <numbers>0</numbers>
        <location>location</location>
      </singleMeal>
    </catering>
    <generalRemarks>generalRemarks</generalRemarks>
  </DPRinfo>
</ns2:Create_DPR>
